{
  "$schema": "../schemas/frontend-inventory.schema.v1.json",
  "schemaVersion": "1.0",
  "source": "Nodes Wizard test fixture for Comfy-Org/ComfyUI_frontend package 1.48.7",
  "frontendVersion": "1.48.7",
  "capturedAt": "2026-08-13T12:00:00Z",
  "nodes": [
    {
      "classType": "Reroute",
      "packageId": "comfy-core",
      "dev_only": false
    }
  ]
}
